{
  "$schema": "https://json-schema.org/draft/2019-09/schema",
  "$id": "https://vibe-iterate.626labs.dev/schemas/config.json",
  "title": "vibe-iterate per-project config",
  "description": "Generated by Ptolemy at first run from codebase + README inference; user-editable. Lives at .vibe-iterate/config.json in the host project.",
  "type": "object",
  "required": ["category", "competitors", "framework_pins", "last_inferred_at"],
  "additionalProperties": false,
  "properties": {
    "category": {
      "type": "string",
      "minLength": 1,
      "description": "One-line description of the app's product category, used by Competitive mode and Product Hunt scans"
    },
    "competitors": {
      "type": "array",
      "items": { "type": "string", "format": "uri" },
      "description": "User-curated list of competitor URLs (changelogs, what's-new pages, GH releases). Used by Competitive mode."
    },
    "framework_pins": {
      "type": "array",
      "items": {
        "type": "object",
        "required": ["name", "version"],
        "additionalProperties": false,
        "properties": {
          "name": { "type": "string", "minLength": 1 },
          "version": { "type": "string", "minLength": 1 }
        }
      },
      "description": "Framework/SDK pins as scanned from package.json. Used by scheduled radar refresh and /scan-releases."
    },
    "last_inferred_at": {
      "type": "string",
      "format": "date-time",
      "description": "ISO-8601 timestamp of last codebase+README inference run"
    }
  }
}
